,taste,quantity,delivery,reviews,store_name
1820,5,5,2,원래 초코쉐이크가 이렇게 적게오나요?비닐봉투에 콜라빨대도 없고 뚜껑도 없어서 혹시나 배달원분이 드신 건 아닐까 의심되서요.요즘같은 시국에 만약에 배달원 분이 드신거라면 침전물이 섞여서 제가 병균에 전염 될 수도 있잖아요.성실하게 답변해주시기 바랍니다.,롯데리아-남부터미널점
1821,3,5,5,버거소스양이 부족해서 아쉬웠음,롯데리아-남부터미널점
1822,3,5,5,빅불버거 맛은 괜찮았는데요 감자튀김이 좀 눅눅해져서 좀 실망했습니다 다음 재주문시 좀 바삭한 상태에서 가져다주었으면 좋겠습니다.,롯데리아-남부터미널점
1823,2,3,1,배달도 오래 걸렸구.. 폴더버거 처음 먹어보는데 맛도 그냥 그랬어요~,롯데리아-남부터미널점
1824,2,5,5,바로 밑 리뷰대로 두 햄버거에 마요네즈 소스가 많이 과합니다.,롯데리아-남부터미널점
1825,2,5,3,마요네즈가 너무 많아서 짜다는 느낌이 들었어요. 다른매장에서는 못느껴본 짠맛..ㅜ.ㅜ,롯데리아-남부터미널점
1826,5,4,2,"따뜻하게 배달되어 맛있게 먹었습니다. 그런데 배달기사님은 문앞에놓고 전화달라고 했는데 벨을 왜 누르는건지, 개선이 필요합니다",롯데리아-남부터미널점
1827,2,5,5,핫크리스피버거 닭껍질없었으면 좋겠어요...ㅜ,롯데리아-남부터미널점
1828,4,3,3,배달도 빠르고 식지 않게 와서 맛있게 먹었어요!,롯데리아-남부터미널점
1829,2,5,4,양념감자 시즈닝 빠져서 왔습니다. 귀찮아서 그냥 먹었습니다.,롯데리아-남부터미널점
1830,2,3,5,기름이 느끼했어여 ㅠㅠ 인기지점이라 그런듯,롯데리아-남부터미널점
1831,3,4,3,전반적으로 소스양이 좀 적었어요 특히 티렉스버거가 적었어요,롯데리아-남부터미널점
1832,2,2,2,비안올때 주문했는데 예상시간 초과되고 감자담은 포장지는 개봉되어 눅눅하고 다식어서 최악이네요,롯데리아-남부터미널점
1833,1,1,1,여러번 시켜서 케찹 좀 달라고 하는데 참 주지도 않고 그렇게 케찹이 아까우시면 사이드로 팔아요 그냥 사먹게 더러워서정말 어휴 그리고 새벽한시에 초인종 누르는건 도대체 무슨 경우인지 배달사항에 분명히 전화달라고 했는데 배달기사님 제발 숙지좀하세요,롯데리아-남부터미널점
1834,3,4,5,두가지맛 먹어봤는데 글쎄요..,롯데리아-남부터미널점
1835,4,3,5,특이하게 나름대로 매력이 있는데 양은 좀 아쉽네요.,롯데리아-남부터미널점
1836,4,3,4,맛있어요. 배달비없어서 좋아요,롯데리아-남부터미널점
1837,1,1,5,버거 진짜 접으려고 하시는군요,롯데리아-남부터미널점
1838,1,1,1,콜라안주시는게 벌써 2번째라서 씁니다. 세트시킬때 콜라주문 따로해야되나요,롯데리아-남부터미널점
1839,2,2,2,"맛, 양, 배달 그저 그래요",롯데리아-남부터미널점
1840,1,1,5,별론데요...ㅡㅡㅋ,롯데리아-남부터미널점
1841,3,5,5,맛이너무없어ㅠ 그냥 햄버거가맛이없음ㅠ,롯데리아-남부터미널점
1842,4,2,3,갓데리아네 하지만 클래식에 있는 마요네즈 양을 조금 줄여야될듯,롯데리아-남부터미널점
1843,1,5,1,다 식어서 옵니다.,롯데리아-남부터미널점
1844,5,5,2,양념감자 시즈닝 추가했는데 안왔네요.. 시즈닝 가져다 달라고 하기도 뭐하고 이런경우가 자주 있는데 잘 확인 후에 배달해주세요,롯데리아-남부터미널점
1845,3,3,5,혼닭 너무 짜고 말랐어요 롯데리아는 좋은데 다른거 먹으려고요,롯데리아-남부터미널점
1846,5,5,2,배달좀 늦은거빼곤 잘먹었습니다,롯데리아-보라매타운점
1847,4,4,3,예상시간보다는 조금늦었지만 잘먹었습니다~!,롯데리아-보라매타운점
1848,2,3,1,배달 늦음 다식어있음,롯데리아-보라매타운점
1849,1,1,1,"배달 예정시간보다 30분 늦게 오고, 콜라 얼음도 빼달라고 썼는데 그대로 오고 음식은 다 식고 ㅋ 두번은 안시킬게요^^ 요청사항 무시할거면 왜 적는란이 있는지ㅋ",롯데리아-보라매타운점
1850,5,5,3,배달은 많이 늦었지만 맛있어요,롯데리아-보라매타운점
1851,3,3,1,너무 늦었어요... 요청사항도 안보다가 뒤늦게 확인하시고 서비스 너무 엉망이에요,롯데리아-보라매타운점
1852,3,4,2,30분이면 온다는 배달이 50분정도 걸렸고 음료안에 얼음은 다 녹아서 밍밍하고 버거는 온도가 아예없네요,롯데리아-보라매타운점
1853,1,5,3,1. 아침 9시 31분에 주문해서 30분 걸린다더니 10시 21분쯤에 도착. (배달은 그럴 수 있다고 생각합니다.) 2. 햄버거 감자튀김 새벽에 만들어 놓은 거 주신 거 주신건지 차가워서 먹을 수가 없네요. 미지근도 아니고 시원한 음식이었어요. 감자튀김은 시원하고 딱딱하고 햄버거도 시원하고 ㅋㅋㅋㅋㅋㅋ 치즈스틱은 아무리 그래도 이해하겠는데 영 아니네요.. 다른 리뷰에도 비슷한 거 있던데 신경 좀만 더 써주세요.,롯데리아-보라매타운점
1854,1,1,1,배달시간이 엄청 늦었습니다 또한 배달시간이 늦다보니 음식이 다 식었습니다. 도저히 먹을수 없어서 버렸습니다 주위해주세요,롯데리아-보라매타운점
1855,5,5,2,"요청사항도 잘 들어주시고 좋았는데, 배달.. 문앞에 두고 문자달라고 말씀드렸는데 벨누르시고 나올때까지 문두드리셔서..ㅠㅠ",롯데리아-보라매타운점
1856,3,5,1,맛은 평범했습니다 .,롯데리아-보라매타운점
1857,5,5,1,"오늘은 배달이 별로네요 도착문자, 벨소리도 없어서 음식 늦게 받아보네요",롯데리아-보라매타운점
1858,3,5,4,무난무난 함니다 좋아요 !,롯데리아-보라매타운점
1859,2,5,5,채소가 상한건가싶을정도로냄새가나네요 다빼고먹었습니다,롯데리아-보라매타운점
1860,1,1,1,배달시간 예상보다 20분 늦ㅇㄷㅁ,롯데리아-보라매타운점
1861,3,5,2,배달이 늦어지다보니 음식이 식어버렸네요ㅠㅜ,롯데리아-보라매타운점
1862,4,4,3,가까워서 시키긴하는데 영 성의가 없음~ 포장은 매번 지적하는데 똑같이 허접하고~ 배달시간도 매번 늦고~ 맛도 내용물도 딱 욕먹지 않을 정도만..,롯데리아-보라매타운점
1863,3,3,5,양상추가 너무 적게 들었네요. 양상추 많이 넣어주세요,롯데리아-보라매타운점
1864,3,3,2,칠리스프 하나더추가했는데 쉑쉑칠리원래 스프하나오는거고 하나 더시켯음줘야지 200때매 걍그러려니하는데 잘점하세요,롯데리아-보라매타운점
1865,3,3,4,배달이 참 빨라요 ~~~,롯데리아-보라매타운점
1866,1,1,1,지금까지 동네 롯데리아 중에서 여기가 젤 맛있는거 같아서 여기서 시켰는데 배달 예정시간이 훨 지나도 오지도 않고 있네요,롯데리아-보라매타운점
1867,3,3,5,배달이 빠르고 친절했어요,롯데리아-보라매타운점
1868,3,5,5,오랜만에 군대리아가 생각나 시켜봤는데 역시 군대리아는 부대에서만 먹는걸로..,롯데리아-보라매타운점
1869,3,3,5,포테토 다 식어서..ㅠ 속상했어오,롯데리아-보라매타운점
1870,5,5,3,자주 시켜 먹는곳인데 오늘은 너무 식어서 왔어요,롯데리아-보라매타운점
1871,1,1,1,세트주문두개시켰는데 둘다 감자튀김이 안오는경우도있네요.,롯데리아-보라매타운점
1872,3,5,2,"음 폴더버거는 처음 먹어봤는데 그냥 편의점피자 반접어먹는 기분이었어여 롯데리아는 그냥 불고기버거,데리버거 먹는게 답인듯. 포장을 하다말았는지 햄버거는 포장이 반쯤 벗겨져서 따로놀고 종이가방안에서 감자는 날라다니고 난리네여. 배달은 빨리왔는데 매장에서 포장을 대충한듯 ㅠ",롯데리아-보라매타운점
1873,4,4,3,잘 먹었습니다...,롯데리아-보라매타운점
1874,1,1,1,배달 개느림 콜라 얼음 다녹아서 오고 감자튀김 다식어서 소금기 1도 없고 개빡침,롯데리아-보라매타운점
1875,3,3,3,그냥저냥 맛이 그랬습니다.,롯데리아-보라매타운점
1876,1,1,5,감자튀김라지시켰는데 켸챱1개 음료수 빨대는 오지도않고 참나,롯데리아-보라매타운점
1877,5,5,1,잘 먹었습니다~~ 배달하신분이 바쁘셨는지 노크한번하시구 문옆에 놓고가신점만 뺀다면.. 만족스러웠습니다,롯데리아-보라매타운점
1878,3,3,3,불고기버거..???,롯데리아-보라매타운점
1879,5,5,1,맛있게 먹었는데 배달원 불친절하네요,롯데리아-보라매타운점
1880,3,4,4,비가 와서그런지 눅눅햇어요ㅜㅜ그래도 잘먹엇습니다,롯데리아-보라매타운점
1881,3,4,5,호기심으로 한번 먹어봏망함,롯데리아-보라매타운점
1882,5,5,3,빨대안와서 뚜껑따고마시다 흘림 행사라 정신이없나보네여 그치만 배달 1시간넘게걸리니 집가까운데서시키셈그냥 35분걸린다해서시켯는데 낚임,롯데리아-보라매타운점
1883,5,5,1,빨대 안 왔음. 그래서 사이다 덮개 뜯어서 마셨는데 사이다 안에 검은색 조그만 이물질 하나 있었음. 뭔지는 모르겠는데 벌레 같은건 아니고 쌀알 크기의 이물질임.,롯데리아-보라매타운점
1884,3,3,3,"너무 느렸어요.. 배달이아니라 준비?시간이 오래걸린거 같아요 출발을 늦게했음. 근데 늦게 준비된거치고 감자튀김, 치즈스틱이 너무 딱딱해서 전자렌지에 돌려먹었어요. 새우버거만 따뜻해서 괜찮았어요 아쉽습니다...ㅠㅠ",롯데리아-보라매타운점
1885,2,4,1,"배달 서비스 진짜 답없네요. 분명 요청사항 문 앞에 두고 전화주세요로 저장해서 주문했는데, 전화도 안하고 바로 문 두드리길래 놓고 가신줄알았는데 또 노크하면서 소리치는건 뭐에요? 진짜 기분나빠서 밥맛 다 사라지네요.",롯데리아-보라매타운점
1886,5,5,2,잘먹었습니다 즐거운하루되세요,롯데리아-보라매타운점
1887,5,3,5,토마토는 추가하면 한개뿐이라 아쉽습니다.,롯데리아-보라매타운점
1888,4,5,3,비가와서 좀 눅눅했고 배달오류로 너무기다림요ㅜ,롯데리아-보라매타운점
1889,2,2,5,좀 조미료 탓인가 ? 느기한느낌 ....,롯데리아-보라매타운점
1890,4,2,4,맛있어요 담백한 소고기패티 넘 맛있어요,롯데리아-보라매타운점
1891,3,4,4,배달두빠르고 맛나네여,롯데리아-구의역점
1892,5,3,3,간단히 먹을때는 최고임다,롯데리아-구의역점
1893,3,2,3,으음 구의역 롯데리아... 그닥 이네요 ㅠㅠ ..,롯데리아-구의역점
1894,3,3,5,배달빠르고 죠음 맛나게먹음,롯데리아-구의역점
1895,3,3,3,롯데리아구의역점롯데리아구의역점롯데리아구의역점,롯데리아-구의역점
1896,3,3,3,가까워서 배송도 빠르고자주 시켜 먹어요,롯데리아-구의역점
1897,3,3,4,너겟을 시켯는데 감자튀김이 왔네요. 신경써주세요~!,롯데리아-구의역점
1898,5,4,1,주문 품목이 제대로 오지 않아서 기다리다가 다른 버거들과 감튀가 전부 식었네요. 신경써주세요,롯데리아-구의역점
1899,1,1,1,소스랑 야채 .. 요청사항까지 써놨는데 이렇게 해주시다뇨.. 요청사항 이행 못할것 같으면 주문취소를 해주시던가 .. 뭐하자는 건지 고객센터에 전화해서 재배송 해달라니까 이미 먹은건 재배송이 안된대요 ? 아무리 지점바이지점이라지만 이건 그냥 고객을 *로 아는건가요??,롯데리아-구의역점
1900,5,4,3,잘먹었습니다 배달분께서 ㅡ퉁명해서 고거이 좀,롯데리아-구의역점
1901,5,5,1,지파이에서 기름이 셌는지 봉투 옆면이 흠뻑젖고 휴지도 다 젖고 케첩도 기름범벅... 어떻게 기름이 이렇게 많은건지.....,롯데리아-구의역점
1902,3,3,1,최소한 감자튀김 입구에 테이프정도는 붙어있어야하는데 없어서 매우 찜찜했습니다,롯데리아-구의역점
1903,1,3,5,한두번도 아니고 여긴 양념감자 스프를 왤케 자주 빼먹으세요? 500원 더 받아놓곤 안주시면..참..500원땜에 알바랑 전화로 이래저래 시간보내기도 짜증나서 그냥 별점깎아드립니다.,롯데리아-구의역점
1904,1,2,5,새우버거와 핫크리스피버거 주문했는데 배달온거 보니 티렉스버거로 왔음 그래서 다시 가져다 달라 하려니 우리나 여기나 귀찮을것같아서 그냥 먹었는데 티랙스버거 안에 패티는 제대로 익지않은건지 고기가 약간 흐물거리고 소스도 거의 없고 맛없었음 진심 너무 빡쳐서 반도 안먹고 갖다 버림ㅡㅡ,롯데리아-구의역점
1905,4,3,2,배달이 조금 늦어요 맛이나 다른건 문제없음,롯데리아-구의역점
1906,5,5,1,홀뤼 밸 누르지 말라니까 눌러버리네,롯데리아-구의역점
1907,3,3,4,배달은 빠르나 음식이 전체적으로 식어서 맛이 반감됐어요..,롯데리아-구의역점
1908,3,5,5,먹을만하네욯ㅎㅎㅎㅎ,롯데리아-구의역점
1909,1,1,5,롯데리아는 요청사항을 전혀 안 보나봐요 자주 시켜 먹는 곳에서 콜라 얼음 빼달라고 하는데도 자꾸 꾸역꾸역 넣어 보내서 장소를 바꿨는데 여기도 가득가득 얼음 채워 주시네요 요청사항 안 적은 줄...,롯데리아-구의역점
1910,3,4,5,너무 맛있어요~~~~~~,롯데리아-구의역점
1911,3,3,3,빨대가 안왔어요~~~~~ 다행히 집에 하나 있어서 그걸 썼지만.. 담엔 꼼꼼히 챙겨보내주세요,롯데리아-구의역점
1912,4,3,5,맛있게 잘 먹었습니다,롯데리아-구의역점
1913,3,4,5,빨리 와주셔서 감사합니다,롯데리아-구의역점
1914,5,3,1,배달 하시는 기사분이 요청사항을 안읽으시나요? 늦은시간 시켜서 제발 벨이나 노크하지말아달라고 그렇게나 적어두었는데 진심 실망~~,롯데리아-구의역점
1915,5,5,1,항상 만족했는데 이번엔 기사분이 요청사항 안보고 문 쾅쾅하고 가시네요..,롯데리아-구의역점
1916,4,4,3,맛 괜춘 양괜춘 배달속도 아쉽,롯데리아-구의역점
1917,1,1,5,티렉스버거를 매주 먹는 1인인데 늘 먹던 지점이 영업시간이 끝나 할수 없이 여기에 주문해서 먹엇더니 진짜 욕나올뻔. 재료가 오래된건지 확인좀 해보셈. 무슨 치킨 너겟도 아니고 다른곳과 비교라도 해보든가. 고기가 오래되면 쪼그라드는거 아시죠? 딱 그상태엿음.!!!,롯데리아-구의역점
1918,3,4,5,차갑게 도착요 배달은 늦지 않았지만 차갑고 내용물도 별로네요,롯데리아-구의역점
1919,1,1,1,케찹넣어달라는데안넣어줘여 주문시요청사항안보나여...,롯데리아-구의역점
1920,2,2,2,그냥 그러네요 그래요,롯데리아-구의역점
1921,1,1,5,진짜 화나서 남깁니다 왜사진엔 딸기잼있는데 딸기쨈 안오고 마요네즈 옵니까 옛날 생각에 빵에 딸기잼 생각하면서 주문했는데 실망만 큽니다,롯데리아-구의역점
1922,3,4,5,패스트푸드라 빨리 오니 좋네요. 만들어 먹는 버거 보만 만들어진 버거가 더 맛있네요. 쉑쉑 치킨 좀 닭내나요. ㅠㅠ 냉동닭인가,롯데리아-구의역점
1923,2,1,1,양념감자에 양념이 안옴 케찹이라도 하나 왔으면 그러려니 하고 먹으려고했는데 치킨너겟 치즈스틱 시켰는데도 케찹 하나 안옴 전화해서 양념감자 소스랑 케찹없다고 하니까 가져다 준다고는 하는데 원래 케찹은 안넣어준다고함 !? 당황잼,롯데리아-구의역점
1924,1,2,1,아니 시즈닝 추가한 돈은 돈 아닌가요 나가서 땅 파봐요 돈이 쉽게 나오 저번에도 추가했는데 안갔다주고 그럴꺼면 추가 목록에 올리지마요 한두번도 아니고 제발,롯데리아-구의역점
1925,3,3,3,평범합니다 적절하게,롯데리아-구의역점
1926,3,3,5,맛은보통이에요...,롯데리아-구의역점
1927,1,2,5,"오랜만에 롯데리아버거 먹어봤는데 진~짜 돈아깝네요. 그냥 버거킹 시킬껄.. 롯데리아 망삘이에요. 군데리아버거는..이거 계획하고 만든사람 시말서 써야해요. 햄, 패티, 치즈 완전 싸구려.",롯데리아-구의역점
1928,4,4,1,불고기버거 세트 2개 주문했는데 콜라가 안왔어요. 클레임 걸었는데 죄송하단 말도 없네요,롯데리아-구의역점
1929,1,1,5,진짜 너무하네요 감자튀김있는데 케찹 하나도 안주는게 맞는건가요? 치킨 다리랑 날개로 달라고 했는데 안되나요? 본사 방침상 되는걸로 알고있는데 어이없네요,롯데리아-구의역점
1930,2,2,5,맛이...없어요.... 추천하지 않아요....,롯데리아-구의역점
1931,3,3,3,그냥 평범한 롯데리아다,롯데리아-구의역점
1932,3,5,5,탄산없는 콜라...ㅠㅠ아쉬워요,롯데리아-구의역점
1933,1,3,5,진짜 믿고 거르는 롯데리아 내가 다시 시키면 사람이 아니다,롯데리아-구의역점
1934,1,1,1,음식도 엉망 배달도 엉망이네요,롯데리아-구의역점
1935,3,3,5,잘먹었어요@!!!!!!!!,롯데리아-구의역점
1936,1,2,2,맛이 별루..야채가 엄청 조금 들어있어서 놀람..,롯데리아-구의역점
1937,5,5,1,빨대가 없어서 불편했네요ㅠㅠ 배달하시는 분이 챙겼어야 하는건가요??,롯데리아-구의역점
1938,1,1,5,오오오? ! ? . .,롯데리아-구의역점
1939,4,3,4,오늘도 잘 먹엇습니다~~,롯데리아-구의역점
1940,3,3,1,왔으면 왔다고 전화라도 주던가.... 벨도 안누르고 머하자는건지...,롯데리아-구의역점
1941,3,3,1,배달기사가 ㅋㅋㅋ 전화도안하고 문앞에다 음식 떨구고 가네요 ㅋㅋㅋㅋ 아이가없네,롯데리아-구의역점
1942,1,2,3,아이스크림은먹다만것처럼오고햄버거야채는상하기직전처럼냄내나려고하며닭패티는수분이다날라가질기고깔깔한게먹다먹다이런햄버거는첨이네요..ㅡㅡㅋ,롯데리아-구의역점
1943,3,3,3,ㅇㅇㅇㅇㅇㅇㅇㅇㅇㅇ,롯데리아-구의역점
1944,1,1,5,미라클버거 최악이다...,롯데리아-구의역점
1945,1,1,3,베이컨 모짜렐러 인더버거 시켰는데 베이컨 새우버거가 왔네요?,롯데리아-구의역점
1946,3,3,5,패티가 5mm정도로 얇고 양배추가 너무 적어요ㅠ 사진에 보이는 만큼이 전부에요; 소스는 한쪽에 치우쳐있어요 ㅠ,롯데리아-구의역점
1947,3,3,3,케찹이랑 빨대를 안주셔서 좀 놀랐네요 처음에 전화해서 빨대가 안왔다고하니 시큰둥하시다가 케첩도 안왓다고 말씀드리니 그제서야 미안하다고 말씀하시는데 좀 씁쓸했네요 고시원이라 여유분빨대도 없었고 케첩은 더더욱 없었는데,롯데리아-구의역점
1948,3,5,5,배달도 빠르구 잘 먹었습니당,롯데리아-구의역점
1949,1,1,5,흐음........,롯데리아-구의역점
1950,1,1,1,레몬에이드에 머리카락이 들어있어서 연락하고 계좌드렷는데 환불이안되어있어서 그냥 리뷰로 남겨둡니다.. 콜라였으면 그냥 머리카락우린콜라를 먹었겠네요.. 세스코 마크 왜붙어있는거지 일부로 붙어있는곳 시킨건데;,롯데리아-구의역점
1951,3,3,5,그럭저럭한 맛입니다.,롯데리아-구의역점
1952,2,3,5,배고파서 시켯어요ㄴㅇ,롯데리아-구의역점
1953,4,2,5,"치즈인더에그 3600원, 1개에 1800원 실화입니까? 와 다른 치킨가게 치즈볼도 개당 1000원꼴인데 2배네요. 뭔가 제가 착각한거였으면 좋겠어요.",롯데리아-구의역점
1954,3,3,4,폴더버거는 조금 아쉽네요 차라리 빵을 얇게하고 가격을 내리심이,롯데리아-구의역점
1955,3,3,3,폴더버거 시켜봤는데 사진이랑 다르게 부실하네요 ㅜㅠ,롯데리아-구의역점
1956,5,1,5,???????? 반밖에 안 찼어요 ????????,롯데리아-구의역점
1957,3,3,3,감사합니다 너무잘먹었습니다,롯데리아-구의역점
1958,3,3,3,맛있어요짱짱 햄버거,롯데리아-구의역점
1959,3,3,1,벨 누르지 말아달랬는데 눌러서 부모님께서 다 깨셨어요;,롯데리아-천호역점
1960,1,1,1,지난번에도 그러더니 천호점 컴터 바꿔야 되는거 아님 컴퓨터때문에 배송지연이 30분이면,롯데리아-천호역점
1961,4,3,1,벨 누르 지 말하고 했는데 벨 누르고 문 두드리고 새벽에 날리난다!!!!!!!,롯데리아-천호역점
1962,1,5,5,새우버거는 잘먹었는데 핫크리스피치킨버거에서 치킨 뼛조각이 나왔네요 1센치 약간넘는데 드실때 조심하세요 천천히 먹어서 다행이지 그냥 삼킬뻔했어요ㅠ불안해서 당분간 햄버거 못먹을듯,롯데리아-천호역점
1963,3,3,3,맛있게 먹었습니다^^,롯데리아-천호역점
1964,3,3,2,나쁘지않음 다른곳 보다 소스많아서 좋음,롯데리아-천호역점
1965,1,1,1,바로 취소했는데매장전화해서 취소하라고 몇분만에 취소안해주네요 참 어이없네요.,롯데리아-천호역점
1966,3,3,3,4000원 할인은 좋다,롯데리아-천호역점
1967,1,1,5,배달만 빠르고 햄버거는 엉망으로옴 역시 롯데리아 거르세요~,롯데리아-천호역점
1968,1,1,1,배달 늦음. 햄버거 다 식고 터짐. 감자튀김 눅눅하고 늘러붙음. 콜라 얼음 녹음. 최악. 이렇게 장사하면 호되게 혼남. 때찌.,롯데리아-천호역점
1969,5,2,5,커피 얼음을 빼고 달라고 했지 한입거리만 달라고는 안 했는데 이만큼 왔어요 참고하세요 2600원어치가 30미리도 안 되네요,롯데리아-천호역점
1970,3,3,1,"정말 솔직히말해서, 배달부분은 별점 주는것 조차 아깝네요 분명히 도착후에 문자 달라고 말씀드렸는데 그냥 가버린건 도대체 뭘까요? 배달온거 언제부터였는지도 모르겠는데 밖에서 방치되어있어서 햄버거랑 치킨팩 다 식어서 맛없었어요 햄버거 한입먹고 버렸고 치킨은 그냥 먹어보기도싫어서 옆에 지금 놔두고 쳐다보는중이에요. 이 음식물 쓰ㄹ기들을 어떻게할까. 기사 누구였는지좀 알려주실래요?",롯데리아-천호역점
1971,1,1,1,*느림 감튀 흐물흐물,롯데리아-천호역점
1972,5,3,5,패티가 다른 지점에 비해 많이 작은거같아요ㅠㅠ 불고기버거는 야채도 별로없어서 실망스러웠어요 감튀는 맛있었어요,롯데리아-천호역점
1973,3,3,3,"햄버거는 조금 따뜻한데 감자튀김은 식고, 오래된건지 눅눅해진걸 주네요",롯데리아-천호역점
1974,5,2,1,기다리다가 배달 않오길래 혹시나 해서 현관홱인하니 그대로 두고 갔네요 앞으로는 맥도날드로,롯데리아-천호역점
1975,2,5,5,도로상황 안좋은데도 대체로 빨리 배달되서 기분좋았는데 버거 속 쏘스가 거의없어 뻑뻑하게 먹었네요 신경좀 써주세요,롯데리아-천호역점
1976,3,4,4,햄버거는 맛있게 먹었는데 감자튀김이 다 식어서 와서 너무 별로였어요. 콜라는 평소보다 살짝 물탄맛인데 설마 그렇진 않겠죠 ㅎ,롯데리아-천호역점
1977,4,3,5,솔직히 예전 맛도 안나고 가격만 비쌈,롯데리아-천호역점
1978,5,5,1,문 앞에 놓아 달라고 했는데 새벽한시반인데 벨누르는건 다음에도 벨 누르면 전화해서 따진다ㅡㅡ,롯데리아-천호역점
1979,3,4,5,상하이 스파이시 버거 미만 다 잡,롯데리아-천호역점
1980,1,1,1,"절대, 절대 시켜먹지 마세요. 수도 없이 시켜먹었고 참다참다 못해 한마디 합니다. 음식 * 주실 거면 새벽주문 왜 받으세요? 다른 지점처럼 영업을 하지 마세요; 감자튀김은 다 말라비틀어졌고 햄버거는 다 식었고, 대체 언제 만들어둔 걸 배달하시는 건가요? 이렇게 미리 만들어둔 거 대충 배달할 거면 빨리라도 갖다주시던가요. 50분이나 기다렸는데 ㅋㅋ 아예 감튀를 새로 튀겨도 몇 번은 더 튀길 수 있는 시간 아니에요? 제가 왜 12000원 내고 이런 * 먹어야 하나요? *",롯데리아-천호역점
1981,1,1,1,그냥그래요 배달맨도 성의없고....,롯데리아-천호역점
1982,1,3,3,배달시간도 엄청 오래 걸렸고 그보다 햄버거랑 감자는 싹다 식었고 음료에 얼음도 다 녹아서 완전 밍밍한 상태였는데 전자레인지에 음식 다 돌려서 먹어야해서 상당히 불편했네요,롯데리아-천호역점
1983,3,4,5,베이컨 모짜랠라 맛남 티렉스는 억지로 먹음 노추천,롯데리아-천호역점
1984,4,4,1,햄버거 하나 포장 제대로 안된상태였고 감자튀김은 절반쯤 엎어져서옴,롯데리아-천호역점
1985,4,4,3,롯데리아는 데리버거가 진리죠😅,롯데리아-천호역점
1986,3,5,3,. ㅌ ㅌㅌ ㅋ ㅋ ㅋ ㅋㅋ,롯데리아-천호역점
1987,2,1,2,소스가 넘적어요 맛이 없어요,롯데리아-천호역점
